1|0.0|DHCP(UDP)|DHCP Request  - Transaction ID 0x53ab5dc9|0.0.0.0:68|255.255.255.255:67|364|0101060053ab5dc90000800000000000000000000000000000000000dcfb48a3711800000000000000000000000000000000000000000000000000000000000000000000000000000000000000000000000000000000000000000000000000000000000000000000000000000000000000000000000000000000000000000000000000000000000000000000000000000000000000000000000000000000000000000000000000000000000000000000000000000000000000000000000000000000000000000000000000000000000000000000000000000000000000000000000000000000000000000000638253633501033d0701dcfb48a371183204c0a801f40c0f4445534b544f502d4c4253554e4d4651120000004445534b544f502d4c4253554e4d463c084d53465420352e30370e0103060f1f212b2c2e2f7779f9fcff
5|0.116365|DHCP(UDP)|DHCP ACK      - Transaction ID 0x53ab5dc9|192.168.1.254:67|255.255.255.255:68|391|0201060053ab5dc90000800000000000c0a801f40000000000000000dcfb48a3711800000000000000000000000000000000000000000000000000000000000000000000000000000000000000000000000000000000000000000000000000000000000000000000000000000000000000000000000000000000000000000000000000000000000000000000000000000000000000000000000000000000000000000000000000000000000000000000000000000000000000000000000000000000000000000000000000000000000000000000000000000000000000000000000000000000000000000000638253633501053604c0a801fe3304000151803a040000a8c03b04000127500104ffffff000304c0a801fe0604c0a801fe0f0c6174746c6f63616c2e6e65747d2900000de9240406303031453436050e5239315648394843313030383139060a4247573231302d3730300204ffffb9b0ff
9|0.128526|LLMNR(UDP)|Standard query 0xd5c6 ANY DESKTOP-LBSUNMF|192.168.1.244:53158|224.0.0.252:5355|75|d5c6000000010000000000000f4445534b544f502d4c4253554e4d460000ff0001
12|0.139545|DNS(UDP)|Standard query 0xf258 SRV _ldap._tcp.dc._msdcs.attlocal.net|192.168.1.244:55606|192.168.1.254:53|93|f25801000001000000000000055f6c646170045f746370026463065f6d73646373086174746c6f63616c036e65740000210001
13|0.148268|DNS(UDP)|Standard query 0xf5b8 A www.msftconnecttest.com|192.168.1.244:49728|192.168.1.254:53|83|f5b801000001000000000000037777770f6d736674636f6e6e6563747465737403636f6d0000010001
14|0.153352|DNS(UDP)|Standard query 0xafc1 A wpad.attlocal.net|192.168.1.244:52463|192.168.1.254:53|77|afc1010000010000000000000477706164086174746c6f63616c036e65740000010001
15|0.155207|DNS(UDP)|Standard query response 0xf258 No such name SRV _ldap._tcp.dc._msdcs.attlocal.net SOA localhost|192.168.1.254:53|192.168.1.244:55606|149|f25885830001000000010000055f6c646170045f746370026463065f6d73646373086174746c6f63616c036e65740000210001c0210006000100000e10002c096c6f63616c686f7374000a706f73746d6173746572c03f777369b100000e100000070800093a8000000e10
16|0.156333|DNS(UDP)|Standard query 0x2e20 SRV _ldap._tcp.dc._msdcs.attlocal.net|192.168.1.244:60689|192.168.1.254:53|93|2e2001000001000000000000055f6c646170045f746370026463065f6d73646373086174746c6f63616c036e65740000210001
17|0.157355|DNS(UDP)|Standard query response 0xf5b8 A www.msftconnecttest.com CNAME v4ncsi.msedge.net CNAME ncsi.4-c-0003.c-msedge.net CNAME 4-c-0003.c-msedge.net A 13.107.4.52|192.168.1.254:53|192.168.1.244:49728|181|f5b881800001000400000000037777770f6d736674636f6e6e6563747465737403636f6d0000010001c00c0005000100000ba300130676346e637369066d7365646765036e657400c03500050001000000130019046e63736908342d632d3030303308632d6d7365646765c043c05400050001000000130002c059c059000100010000001600040d6b0434
18|0.158059|TCP(TCP)|57951 \xe2\x86\x92 80 [SYN] Seq=0 Win=64240 Len=0 MSS=1460 WS=256 SACK_PERM=1|192.168.1.244:57951|13.107.4.52:80|66|
19|0.164038|DNS(UDP)|Standard query response 0xafc1 No such name A wpad.attlocal.net SOA localhost|192.168.1.254:53|192.168.1.244:52463|133|afc1858300010000000100000477706164086174746c6f63616c036e65740000010001c0110006000100000e10002c096c6f63616c686f7374000a706f73746d6173746572c02f777369b100000e100000070800093a8000000e10
20|0.164724|DNS(UDP)|Standard query response 0x2e20 No such name SRV _ldap._tcp.dc._msdcs.attlocal.net SOA localhost|192.168.1.254:53|192.168.1.244:60689|149|2e2085830001000000010000055f6c646170045f746370026463065f6d73646373086174746c6f63616c036e65740000210001c0210006000100000e10002c096c6f63616c686f7374000a706f73746d6173746572c03f777369b100000e100000070800093a8000000e10
21|0.166208|TCP(TCP)|80 \xe2\x86\x92 57951 [SYN, ACK] Seq=0 Ack=1 Win=65535 Len=0 MSS=1440 WS=256 SACK_PERM=1|13.107.4.52:80|192.168.1.244:57951|66|
22|0.166307|TCP(TCP)|57951 \xe2\x86\x92 80 [ACK] Seq=1 Ack=1 Win=132352 Len=0|192.168.1.244:57951|13.107.4.52:80|54|
23|0.166408|HTTP(TCP)|GET /connecttest.txt HTTP/1.1 |192.168.1.244:57951|13.107.4.52:80|165|474554202f636f6e6e656374746573742e74787420485454502f312e310d0a436f6e6e656374696f6e3a20436c6f73650d0a557365722d4167656e743a204d6963726f736f6674204e4353490d0a486f73743a207777772e6d736674636f6e6e656374746573742e636f6d0d0a0d0a
24|0.177942|TCP(TCP)|80 \xe2\x86\x92 57951 [ACK] Seq=1 Ack=112 Win=2102272 Len=0|13.107.4.52:80|192.168.1.244:57951|60|000000000000
25|0.182521|HTTP(TCP)|HTTP/1.1 200 OK  (text/plain)|13.107.4.52:80|192.168.1.244:57951|566|485454502f312e3120323030204f4b0d0a43616368652d436f6e74726f6c3a206e6f2d73746f72650d0a436f6e74656e742d4c656e6774683a2032320d0a436f6e74656e742d547970653a20746578742f706c61696e3b20636861727365743d7574662d380d0a4c6173742d4d6f6469666965643a205468752c2031362041707220323032302031383a35383a323620474d540d0a4163636570742d52616e6765733a2062797465730d0a455461673a2030783844333433463945393643394441430d0a4163636573732d436f6e74726f6c2d416c6c6f772d4f726967696e3a202a0d0a4163636573732d436f6e74726f6c2d4578706f73652d486561646572733a20582d4d53456467652d5265660d0a54696d696e672d416c6c6f772d4f726967696e3a202a0d0a582d436f6e74656e742d547970652d4f7074696f6e733a206e6f736e6966660d0a582d4d53456467652d5265663a2052656620413a2038303234454339423430373734304645423530453345434435453038413439462052656620423a2044414c45444745303931312052656620433a20323032302d30352d30355430333a33363a34335a0d0a446174653a205475652c203035204d617920323032302030333a33363a343320474d540d0a436f6e6e656374696f6e3a20636c6f73650d0a0d0a4d6963726f736f667420436f6e6e6563742054657374
26|0.182522|TCP(TCP)|80 \xe2\x86\x92 57951 [FIN, ACK] Seq=513 Ack=112 Win=2102272 Len=0|13.107.4.52:80|192.168.1.244:57951|60|000000000000
27|0.182574|TCP(TCP)|57951 \xe2\x86\x92 80 [ACK] Seq=112 Ack=514 Win=131840 Len=0|192.168.1.244:57951|13.107.4.52:80|54|
28|0.182591|TCP(TCP)|57951 \xe2\x86\x92 80 [FIN, ACK] Seq=112 Ack=514 Win=131840 Len=0|192.168.1.244:57951|13.107.4.52:80|54|
29|0.19051|TCP(TCP)|80 \xe2\x86\x92 57951 [ACK] Seq=514 Ack=113 Win=2102272 Len=0|13.107.4.52:80|192.168.1.244:57951|60|000000000000
30|0.220469|SSDP(UDP)|NOTIFY * HTTP/1.1 |192.168.1.82:46433|255.255.255.255:1900|526|4e4f54494659202a20485454502f312e310d0a484f53543a203233392e3235352e3235352e3235303a313930300d0a43414348452d434f4e54524f4c3a206d61782d616765203d20313830300d0a4c4f434154494f4e3a20687474703a2f2f3139322e3136382e312e38323a313430302f786d6c2f6465766963655f6465736372697074696f6e2e786d6c0d0a4e543a20757569643a52494e434f4e5f39343946334544363532393030313430300d0a4e54533a20737364703a616c6976650d0a5345525645523a204c696e75782055506e502f312e3020536f6e6f732f35362e302d373630363020285a50533134290d0a55534e3a20757569643a52494e434f4e5f39343946334544363532393030313430300d0a582d52494e434f4e2d484f555345484f4c443a20536f6e6f735f375a314a3232566447787169624a65797558487567704a356d6e0d0a582d52494e434f4e2d424f4f545345513a2034310d0a582d52494e434f4e2d574946494d4f44453a20310d0a582d52494e434f4e2d56415249414e543a20320d0a484f555345484f4c442e534d415254535045414b45522e415544494f3a20536f6e6f735f375a314a3232566447787169624a65797558487567704a356d6e2e7764362d585f4368324b4f484b3330456c4876420d0a0d0a
31|0.246625|DNS(UDP)|Standard query 0x19e0 A skydrive.wns.windows.com|192.168.1.244:54750|192.168.1.254:53|84|19e00100000100000000000008736b79647269766503776e730777696e646f777303636f6d0000010001
32|0.259255|DNS(UDP)|Standard query response 0x19e0 A skydrive.wns.windows.com CNAME client.wns.windows.com CNAME wns.notify.windows.com.akadns.net CNAME americas1.notify.windows.com.akadns.net CNAME dm3p.wns.notify.windows.com.akadns.net A 52.230.222.68|192.168.1.254:53|192.168.1.244:54750|211|19e08180000100050000000008736b79647269766503776e730777696e646f777303636f6d0000010001c00c00050001000005dd000906636c69656e74c015c0360005000100000515002303776e73066e6f746966790777696e646f777303636f6d06616b61646e73036e657400c04b0005000100000035000c09616d65726963617331c04fc07a00050001000000bf000704646d3370c04bc092000100010000005c000434e6de44
33|0.259794|TCP(TCP)|57952 \xe2\x86\x92 443 [SYN] Seq=0 Win=64240 Len=0 MSS=1460 WS=256 SACK_PERM=1|192.168.1.244:57952|52.230.222.68:443|66|
34|0.28926|TCP(TCP)|443 \xe2\x86\x92 57952 [SYN, ACK] Seq=0 Ack=1 Win=8192 Len=0 MSS=1440 WS=1 SACK_PERM=1|52.230.222.68:443|192.168.1.244:57952|66|
35|0.289413|TCP(TCP)|57952 \xe2\x86\x92 443 [ACK] Seq=1 Ack=1 Win=132352 Len=0|192.168.1.244:57952|52.230.222.68:443|54|
36|0.290226|TLSv1.2(TCP)|Client Hello|192.168.1.244:57952|52.230.222.68:443|234|16030300af010000ab03035eb0df4cc2550d75bff0005b0e86903d7f25536df03df072afb4cb287904ddcf00002ac02cc02bc030c02f009f009ec024c023c028c027c00ac009c014c013009d009c003d003c0035002f000a010000580000001d001b000018736b7964726976652e776e732e77696e646f77732e636f6d000a00080006001d00170018000b00020100000d001400120401050102010403050302030202060106030023000000170000ff01000100
42|0.323361|TCP(TCP)|[TCP segment of a reassembled PDU]|52.230.222.68:443|192.168.1.244:57952|1514|1603030f850200005103035eb0df4c3e4f06a00aba43e5ce95219506cf908db5efa074b8c7dd889f93bcd520d01e0000b34655c2f9b2f595fd581ae881d531a675ace41481e4b5ca92923c7dc02f00000900170000ff010001000b000dfc000df900083b308208373082061fa00302010202137800109b6ccad0f6709fdef420000000109b6c300d06092a864886f70d01010b050030818b310b3009060355040613025553311330110603550408130a57617368696e67746f6e3110300e060355040713075265646d6f6e64311e301c060355040a13154d6963726f736f667420436f72706f726174696f6e31153013060355040b130c4d6963726f736f6674204954311e301c060355040313154d6963726f736f667420495420544c532043412034301e170d3230303231343138333633385a170d3232303231343138333633385a301c311a301806035504030c112a2e776e732e77696e646f77732e636f6d30820122300d06092a864886f70d01010105000382010f003082010a0282010100b1c48ed6998fa9faebf3f647b36e4d6c51776509a5a08e5edb3be2385ddd4319a9ae41780ab3f8088b406f9259bec2e83273d2ea856a107df7142b20442f156970351a08014c3379dce7c2d98ff072577e12c1d874a84fc3d98c9dac49f08b0f8f46bece4598f045550158fb321c7a5cf60eb70dc3f981bc5d63823ff228c1b1bf2be39027ba485d00618f5a4b170a8c73e24b477a01a8f9203a3b931788fb7a14f8a8da4b406d1531bc8a379178165c2f62b550d6168da39e8e30858ca7b835e9aa50b76a54399f1e022f78b23a09bee225909f21162e87c62d707d25b5601a587ae4f433bd449abfc5cde197a0a5a16f1d210f880a50deb036ed91550d62a90203010001a3820400308203fc3082017f060a2b06010401d6790204020482016f0482016b0169007600a4b90990b418581487bb13a2cc67700a3c359804f91bdfb8e377cd0ec80ddc1000000170450641530000040300473045022100a4393c40bf292acda17f70072e6d47d7ac57aeb9c533d984c43525a098dd76f102202a25288b41f0221d197bbb215bd606436505eef7a63fe5cdebf09fcf84921f640076005581d4c2169036014aea0b9b573c53f0c0e43878702508172fa3aa1d0713d30c00000170450642ae000004030047304502201e4ae4dcf9c1ea32da6a059f76fe726023d13dbcd7ac7fb11631ade6f3abc342022100becdb607b0de3c76dab744f76367e78ff76a3e1e50d2203c34fa1287cc54a14700770041c8cab1df22464a10c6a13a0942875e4e318b1b03ebeb4bc768f090629606f6000001704506416b0000040300483046022100cfe58c1515cf6dd5ad8cc138c94c97efc7dc03b8aba8d6987c6071fc30596008022100ea5ce77f722594b4018e27cbcc712b124f0bbbe5cec321cb822d11ed0b0f484e302706092b060104018237150a041a3018300a06082b06010505070302300a06082b06010505070301303e06092b06010401823715070431302f06272b060104018237150887da867583eed90182c9851b81b59e6185f4eb60815d84d2df4282e7937a02016402011d30818506082b0601050507010104793077305106082b060105050730028645687474703a2f2f7777772e6d6963726f736f66742e636f6d2f706b692f6d73636f72702f4d6963726f736f66742532304954253230544c532532304341253230342e637274302206082b060105050730018616687474703a2f2f6f6373702e6d736f6373702e636f6d301d0603551d0e0416041482fbb97712396bfaaee91c96d3e3deb7d9abf061300b0603551d0f0404030204b0301c0603551d110415301382112a2e776e732e77696e646f77732e636f6d3081ac0603551d1f0481a43081a130819ea0819ba08198864b687474703a2f2f6d7363726c2e6d6963726f736f66742e636f6d2f706b692f6d73636f72702f63726c2f4d6963726f736f66742532304954253230544c532532304341253230342e63726c864968
43|0.323528|TCP(TCP)|443 \xe2\x86\x92 57952 [PSH, ACK] Seq=1461 Ack=181 Win=8012 Len=1460 [TCP segment of a reassembled PDU]|52.230.222.68:443|192.168.1.244:57952|1514|7474703a2f2f63726c2e6d6963726f736f66742e636f6d2f706b692f6d73636f72702f63726c2f4d6963726f736f66742532304954253230544c532532304341253230342e63726c304d0603551d2004463044304206092b0601040182372a013035303306082b060105050702011627687474703a2f2f7777772e6d6963726f736f66742e636f6d2f706b692f6d73636f72702f637073301f0603551d230418301680147a7b8cc1cfe7a0ca1cd46bfafbe133c30f1aa29d301d0603551d250416301406082b0601050507030206082b06010505070301300d06092a864886f70d01010b05000382020100495e4868351909dc6a3648e9dd857c9e291571a7262c34076ec99353c730b2603a8db8ff13b15b430137bb1502958f2264166636864f305148daf602f9e331181dbd0903db152aaa117b8e92bb6e1e3b243eeef889a49bcc649bc952c9bf345158290c54fd022a1079435b5801e8f4cd23114d8420c12d84618213e00be62ff7802e46b47e2d488c0a34b9ecf76d8b18097edf7fefbc70b1cfc83fb941c7856a50115661c807ef684aa7cc453bfec7b57ee1509e7de2ea7a4c1675401af61800d35f7992950d1aa1fe3ee7508412911a2bb56954ace1b40575906f40b162751f282eca5fa23c4c7e52952efd093e5a5e4c232bf162c5477d51aa8880a7302014b2ba62a817dc59c094c78e8a371c4f94507ae687d313fdeb353bd5e4d60a8a3c04a0fd6a1573ba8ca3aebf5a98982ee892619723950630c9ef24d38ec7449a4fc17977e47e76b7766b5c226b35d23b242603788febb00a5e76a62bac8e9f7c99cd1df8e7de6b87a017ac9bbe7bf833cd9714908dc3df78eeca1401c85114b07be79143fe61a946cde4bbf2f5b3f3e557abdc4b7588cb507ceeb7c4f1652ae6bf9d6edf25f0b2068daa2dd8640627bc90a1ff239b4de47eb9ddfa9d105fdeed28dbaf710d65cc08a0a673785c34308068028b5bf8c99ee73479c63592661821a08676dd08ee72e3e2c3635903c6af3a37c4ad4ab9cb735bac7f781ac4f8e5bad50005b8308205b43082049ca00302010202100b6ab3b03eb1a9f6c460926aa8cdfeb3300d06092a864886f70d01010b0500305a310b300906035504061302494531123010060355040a130942616c74696d6f726531133011060355040b130a43796265725472757374312230200603550403131942616c74696d6f7265204379626572547275737420526f6f74301e170d3136303532303132353233385a170d3234303532303132353233385a30818b310b3009060355040613025553311330110603550408130a57617368696e67746f6e3110300e060355040713075265646d6f6e64311e301c060355040a13154d6963726f736f667420436f72706f726174696f6e31153013060355040b130c4d6963726f736f6674204954311e301c060355040313154d6963726f736f667420495420544c53204341203430820222300d06092a864886f70d01010105000382020f003082020a0282020100abe5eb5da36b399ef5348812bb1d52265d7d090bc6798eabb70edf19b2ddee0ff6eef456e446e2920fe2670be31c71a4d44173b4cb99168ebf777db0af1e6ced712ec308774a5e92aeec5ad04881d0c5e9a0f57a8f1e8d5ed3ad92c0dac691353120b93904cd102a3c971d009e99181809cf4b97e4c9fc00f00c5a9d36e8b240c14aac8428aa3d46182ba78aacf4af4ba87e4942c76220c0e6a73b5deb901fbb8ad89c90e33ab16cc294ce3e326bcb71b3412eb9c5e15dd8592782fbe1480d7ee804f1f9012741fa945a7dc530bbb6bad7119b88fa01cc6e4b92b9f8783ccb9c689a166688d093b02a832e97111d7e812061e4b0b99b9c6e53959522c6d9bd7510bad9758c3c3f1dd096f833457b7b1f5433e54897a70524a2dbd1dc95ae202a7d9689487b927ad024b1de4811f7673cb4dff85860f54f7b3468e6fdac2608b6f32c43db4fc416d09b0c7187b1076b86dd8fa0b1fb66dad8cbe9f2f065e58ed81cea2fba2d64f15ed01b50b20c
44|0.323529|TLSv1.2(TCP)|Server Hello, Certificate, Server Key Exchange, Server Hello Done|52.230.222.68:443|192.168.1.244:57952|1112|854acf3bc82e2a6a758cc0ae5cd9e9c07c7d7cda9ce3bd4ab06007822b7d5dc810af2e628cdc9afde1d9b9594897421ac350810b1f83226be49bbc292282fd80515c755f0e35c2dd7f2f7a679f3d8e5b8cbbaf9df4cc0cfba81f9d21c1f3e7521a5dce14576d50b849eeb10b27d2e26927126ec6c0263ee7a42b1b8b533806fa1a873ae04b7f99164e593d5969f171a765651b0203010001a38201423082013e301d0603551d0e041604147a7b8cc1cfe7a0ca1cd46bfafbe133c30f1aa29d301f0603551d23041830168014e59d5930824758ccacfa085436867b3ab5044df030120603551d130101ff040830060101ff020100300e0603551d0f0101ff04040302018630270603551d250420301e06082b0601050507030106082b0601050507030206082b06010505070309303406082b0601050507010104283026302406082b060105050730018618687474703a2f2f6f6373702e64696769636572742e636f6d303a0603551d1f04333031302fa02da02b8629687474703a2f2f63726c332e64696769636572742e636f6d2f4f6d6e69726f6f74323032352e63726c303d0603551d200436303430320604551d2000302a302806082b06010505070201161c68747470733a2f2f7777772e64696769636572742e636f6d2f435053300d06092a864886f70d01010b0500038201010011fe72063a210a376ec8f5292202629e450eedfa069fefbf9e243517fe3988b2bb01e178dfd18b97fdb777f18a724f493ae8b329d77487e4b9f317608788925582bdd97d13487f06903a8966e79d96f795cd600fd7e1caf676eefa9b3548a1987dd2932a4f8116c7a896bbd125f3a66f50da009b2aa8f43500e3fd2c3bede5159b7f160fc78ec9362094f01d01b91250509981e028422c8e78ffedc69ed5e4cae9a0aab3484fa45fe48b18ff13022d9011361866283a229ade95f159ee9f6d2a17759350c30512d5de64b4b6bcdbd77659fea5d6e556e1fe465c3b8af8ec0efbef129091ce201281ba3c52e37fe340f40c4120668718da3269e0f6dc8f28f2bd0c00012803001d20da527cc1b5640ec2a5db6692a238e05db4f2a9e1d65c116984fe17641a22a85a040101005b9263088d0cbcfd4997d9bd9e067ab89e7eefb79ebc64f959646f461fdd147499047e91291be8c69fc6696aad2bc66b65bc4da15030e896fdd0b99c319a3e5c8d2ca3f04f1f8af62c7e43a84a5c4017337f4abd0aa13f4fde424b068fb57b67b27c94a6e31903181489c381ff90cd0d3b384e97b4cca9beee6255d6fb67e7721a395bba4bb7f2764e4279a86dbb51522cbec420c352008f71d5f8b756a78d4a45d074f261ab8826f1ab9f3e65a66a4d8a5813acb5ae0f5f585745438884c3ca9b74ff4543738471b20ebb40b568e7225951cd0f7a529eb1f885f625b6becd684f73fa3ece3121f460da85292987dcd3c6fcd888cf54817b166216a0df7034110e000000
45|0.323606|TCP(TCP)|57952 \xe2\x86\x92 443 [ACK] Seq=181 Ack=3979 Win=132352 Len=0|192.168.1.244:57952|52.230.222.68:443|54|
46|0.326745|TLSv1.2(TCP)|Client Key Exchange, Change Cipher Spec, Encrypted Handshake Message|192.168.1.244:57952|52.230.222.68:443|147|160303002510000021203b0c0281e99bd256df9b766d6349df16daa7fc96572e5a69094d3eca062fc259140303000101160303002800000000000000009eeb6d7f6799278fbbbb58e09849aee62a605cf43908d2e1afb247936e85cf58
47|0.357715|TLSv1.2(TCP)|Change Cipher Spec, Encrypted Handshake Message|52.230.222.68:443|192.168.1.244:57952|105|140303000101160303002800000000000000003c6693699cdad9e8c721bb57c1468767090d78fd456029bf1e406b5e2e22ffc6
48|0.359236|TLSv1.2(TCP)|Application Data|192.168.1.244:57952|52.230.222.68:443|314|17030300ff000000000000000168b3822ec88a05738a1465db1641c3e3510f7e0b518e0b63245760d6661ddeca3eb298334665f2a525bf7b6bacf79d82c1e46e4a832c8e304508941d1c11e739d6c1b50375f41adfd701216b62e976d683a59966c73bfbefc2053e8cfb82b76f48a9f84cc460c1bc6167eff8c59a40e8a9de9fa9f2b288751587e432101dd154a5b0793f6815c46d1834e0668707c7e935d43f012a254cccc8beabf2c4d6d564fcccc34ab2084f8441420bd13c34e51ae47d567ca47a15337eca0fdbf6b61c82302dd06ca96403568096de28c6a3a75c6ad0f33569437478a2b37b870a77456382c4c907245894abbcf238dd13774359facc786d4fe122
49|0.390206|TLSv1.2(TCP)|Application Data|52.230.222.68:443|192.168.1.244:57952|324|17030301090000000000000001dbb62e3511829b42c0b5e67ccf6d671d27068e38041a80453fb70858e001568fe7c0f2565e3035e39104c37dd16ee5388eb1873edbd199e5456d5e9608a6356e19286034ccb221a7346c37bd1347d126b260ed1a0b18db95e71ab753544addf90181833ced900c18a96da6344de53d83ece7730c74b103e8407197ee7315a1f1f5f047e28025d6deb8bf6c46d8f71d22f09e4fc9ff41e5b9a8d50843cdd1c6a288616bf43f9c19335a65c3599ee97070b433ff9bd5885cd05e7e3de9a2dcd9aa38a1d2c1a1bad5a1d410c63c1f5a4af30acbb1537f1fb0750c73d1cc93808581a169b5ef96f1c268f5ed59caa64acdeee290505e27f361013f8941dd5d910ef607
50|0.39134|TLSv1.2(TCP)|Application Data|192.168.1.244:57952|52.230.222.68:443|1084|170303040100000000000000026e0c0492dcaf1290ca26dc5f0a47a400492c77200c9dd26913b93deb9f93e27718619ac80956cebe83ae5a6d177f5b3e43a1967ca941721d840774f17de3f3ffdcd200330da5cc00149d6a56afcf7cd0d89e7186567a857a32185c16c2e591906453794b20cdef7ed05e6059ec14885fae516e081e376ca6a769b12b1f52a41cc0040b632236946d469271625bf1b18c8402083d0b723fdf4fb7e9b65eec203fbe4dc4566a2dbfc3bdad1f8d7509a2a2f98b7da6938504a14f0b8b520e6ab467a9a58ebc62f7e09572edebff9c32453340e95a59d72be22853b9c7fa110c7b4e06346ae2e6db187d5f7aef28e19306a0c2e15f96df54ecc5b743a2353cbe24cac1df921ffed497dd181c7d968bfd9701cc9cd485134b3e120f3dda5ac5fdbe671942cd903bbce8ba5e21bbb6b6acb3fb5326c352d1a89542a4e1b19c53244a5959886c6fa626739ce871a7a014665c0c0ef2a5ea34348a3a8b2372f5c584bd7267b36fda10c753737777c0b7aab1d894d6acec2cacd214aec302b8c507960ab0fc044377668d84de23be7332f7516c8c7fa7e691a29061b052280771bfbd2cb210a010a0c70c7d2f854a2f44e3b7732b636de025b37bc3ddd78a708ac4ea3fa466311e8839b27f089e1a1dcbb8658a2efdcb76ce23a11580eb747b8f5f6d611f24c02bf8a12090d224f907f1080140e6c54df549181511d951686762fba7866e0c01d62faa6bb17da2502726a4337b9b49bd9b1f4cadb738290377a8ecece68c987793c80569500a444954504ff9f08cecfe13e54d0024abd144ae7a418cceb204ed09ab4d7f20844e54165d6800481e13121e315f82f1d2a10dab8a018c12ec5ebe335a69bb17d3828c62d1893e934b8781056f5b4bb19cc6d78d88d9041ee52e3b69c0d4b3b235a8eb0f412e0c984ab5f9fbdf02fe0c4a341e2faf4044726aa8b98ea0ed451efe9da81f5fbb96c79370458b0b2adcf613597e25aab35c787fd2d2ec3628ff585993565bf52533467cef3602702d81ff8e66e33e649567185643b99444513337887985b4a2eb2104bb9ba36a1702f8879c759d841c3ff4069aca0d68c2756ac3213eea47deed03accc3ae68743a92699f0cc5072fe7d083e9b85101fda749ae51b6bea16a19d5a569cf81a493954e22246a639a368969a73d0b752f24e0a816e11c34fe5aa068eae12152c1866ebae3ac572690b48230e68097e2e0a49db7bc234db77a696a8f5a99ce48406c7f82816c16856ff91bee987dee56e489c23dff9a35f88b446412398ba3372df6d92bc9d934b245f965ca05cf7a78abcc23a979a1f55f18394f161d904b32a27bb37035790fd9544ccd992acd3e52c89ce8e1276667628f42ff128c7610f36a9263ecf093d542ffcdf3b8292743b079e2eeb53ed52897ea4e44c331df700207afe2eb3ea8ae5
53|0.426745|SSDP(UDP)|NOTIFY * HTTP/1.1 |192.168.1.82:46433|255.255.255.255:1900|579|4e4f54494659202a20485454502f312e310d0a484f53543a203233392e3235352e3235352e3235303a313930300d0a43414348452d434f4e54524f4c3a206d61782d616765203d20313830300d0a4c4f434154494f4e3a20687474703a2f2f3139322e3136382e312e38323a313430302f786d6c2f6465766963655f6465736372697074696f6e2e786d6c0d0a4e543a2075726e3a736368656d61732d75706e702d6f72673a6465766963653a5a6f6e65506c617965723a310d0a4e54533a20737364703a616c6976650d0a5345525645523a204c696e75782055506e502f312e3020536f6e6f732f35362e302d373630363020285a50533134290d0a55534e3a20757569643a52494e434f4e5f39343946334544363532393030313430303a3a75726e3a736368656d61732d75706e702d6f72673a6465766963653a5a6f6e65506c617965723a310d0a582d52494e434f4e2d484f555345484f4c443a20536f6e6f735f375a314a3232566447787169624a65797558487567704a356d6e0d0a582d52494e434f4e2d424f4f545345513a2034310d0a582d52494e434f4e2d574946494d4f44453a20310d0a582d52494e434f4e2d56415249414e543a20320d0a484f555345484f4c442e534d415254535045414b45522e415544494f3a20536f6e6f735f375a314a3232566447787169624a65797558487567704a356d6e2e7764362d585f4368324b4f484b3330456c4876420d0a0d0a
54|0.426827|TLSv1.2(TCP)|Application Data|52.230.222.68:443|192.168.1.244:57952|147|1703030058000000000000000261cb2279b90b55aaba8fb54a58a9b2325b71f48835b6b35fc7fe03891bef0c0d88216feccd51fe1df6c63bbbdcdc011f6ee6150cc06b11de148c4696b098810b2349841b2bfe8428e68f657335789cfb
55|0.426828|TLSv1.2(TCP)|Application Data|52.230.222.68:443|192.168.1.244:57952|224|17030300a5000000000000000337929f8dc99bd3b89216bfe71afeda2f4758fdac96cab4b9124803c829bc6c2ce1ee116ab3e81a60bb044e48d40a87491d5c73f386a2faf09772a939ec5db8a4aa52704632f94494051cafa2ba02fda5fd1c7bbdc432dc66ca10f5b300fccee39453b5f3c55d89f31d8e928af71cc11eab81e967f386b41a898d74c296dbf6c9be687ef8e698558bb7d19303b5e7bbaad2042f5e332b53be13234d8076
56|0.426891|TCP(TCP)|57952 \xe2\x86\x92 443 [ACK] Seq=1564 Ack=4563 Win=131840 Len=0|192.168.1.244:57952|52.230.222.68:443|54|
57|0.429732|TLSv1.2(TCP)|Application Data|52.242.211.89:443|192.168.1.244:57936|229|17030300aa0000000000000004391c21469116a13a56f797208bcb360f40a95499788da6d57c623264fec21c588c41019db88c50d2ed116b8ef6137a0ed94c40f413b406470a7cf2476799251a0073aa32ec1d8cec7bda05964934a99663c004f5e4cb6309e73f93954f1f55f1082ad83ef5ee752d048bdd3ba70a1185ed08dfaaf8709e137096c0ab19962b3f7796d781f1f36f8f1b28cb72afef599142896f339000cbb570f4cc284ba0536a3b23
58|0.429733|TCP(TCP)|443 \xe2\x86\x92 57936 [FIN, ACK] Seq=176 Ack=1 Win=8192 Len=0|52.242.211.89:443|192.168.1.244:57936|60|000000000000
59|0.534268|DNS(UDP)|Standard query 0xa21c A platform.bing.com|192.168.1.244:63134|192.168.1.254:53|77|a21c0100000100000000000008706c6174666f726d0462696e6703636f6d0000010001
61|0.539006|LLMNR(UDP)|Standard query 0xd5c6 ANY DESKTOP-LBSUNMF|192.168.1.244:53158|224.0.0.252:5355|75|d5c6000000010000000000000f4445534b544f502d4c4253554e4d460000ff0001
62|0.543904|DNS(UDP)|Standard query response 0xa21c A platform.bing.com CNAME platform-bing-com.a-0001.a-msedge.net CNAME dual-a-0001.a-msedge.net A 204.79.197.200 A 13.107.21.200|192.168.1.254:53|192.168.1.244:63134|186|a21c8180000100040000000008706c6174666f726d0462696e6703636f6d0000010001c00c000500010000056d002711706c6174666f726d2d62696e672d636f6d06612d3030303108612d6d7365646765036e657400c02f0005000100000010000e0b6475616c2d612d30303031c048c062000100010000000b0004cc4fc5c8c062000100010000000b00040d6b15c8
63|0.54561|TCP(TCP)|57953 \xe2\x86\x92 443 [SYN] Seq=0 Win=65535 Len=0 MSS=1460 WS=256 SACK_PERM=1|192.168.1.244:57953|204.79.197.200:443|66|
64|0.553758|TCP(TCP)|443 \xe2\x86\x92 57953 [SYN, ACK] Seq=0 Ack=1 Win=65535 Len=0 MSS=1440 WS=256 SACK_PERM=1|204.79.197.200:443|192.168.1.244:57953|66|
65|0.553858|TCP(TCP)|57953 \xe2\x86\x92 443 [ACK] Seq=1 Ack=1 Win=262144 Len=0|192.168.1.244:57953|204.79.197.200:443|54|
66|0.557368|TLSv1.2(TCP)|Client Hello|192.168.1.244:57953|204.79.197.200:443|260|16030300c9010000c503035eb0df4cca362b04cee3189ae4917cae2ff382a49dc26cd3efb302a9745b3850000026c02cc02bc030c02fc024c023c028c027c00ac009c014c013009d009c003d003c0035002f000a01000076000000160014000011706c6174666f726d2e62696e672e636f6d000500050100000000000a00080006001d00170018000b00020100000d00140012040105010201040305030203020206010603002300000010000e000c02683208687474702f312e310017000000180006001003020100ff01000100
67|0.558637|DNS(UDP)|Standard query 0xa8eb A xmpp001.zoom.us|192.168.1.244:63835|192.168.1.254:53|75|a8eb0100000100000000000007786d7070303031047a6f6f6d0275730000010001
68|0.567267|TCP(TCP)|443 \xe2\x86\x92 57953 [ACK] Seq=1 Ack=207 Win=2102272 Len=0|204.79.197.200:443|192.168.1.244:57953|60|000000000000
69|0.568747|TCP(TCP)|[TCP segment of a reassembled PDU]|204.79.197.200:443|192.168.1.244:57953|1514|1603031cc90200006203035eb0df4cca4f4cf8df359511b6c52409db738a162e04950f62cfb5a62a7f1fc920e449000049063cb51e769ef5fd134f3eb361c7619102373bb1c721698ea36530c03000001a000500000023000000100005000302683200170000ff010001000b0013bf0013bc000dfe30820dfa30820be2a00302010202132000060f1b8eb1ce4263468342000000060f1b300d06092a864886f70d01010b050030818b310b3009060355040613025553311330110603550408130a57617368696e67746f6e3110300e060355040713075265646d6f6e64311e301c060355040a13154d6963726f736f667420436f72706f726174696f6e31153013060355040b130c4d6963726f736f6674204954311e301c060355040313154d6963726f736f667420495420544c532043412032301e170d3139303433303230343830305a170d3231303433303230343830305a3017311530130603550403130c7777772e62696e672e636f6d30820122300d06092a864886f70d01010105000382010f003082010a0282010100e12253dbd223fbc5199449c2b8dd023b0a2fe5bdf32e9968511401dc1738c80c7b3be2cab407ecdef075b93d1e8b5917bf777c91e5d0bcee042cd2a5c68adcec3fdbd625ca70295dbbded9675a211f819c79b6f34215d1ceaa86281cbddaf3379dfc99064c4797ba41845f44de0600a37154e3e6a4712618e55b1b3701c07fab87f8be2dd01bcd136d253650ed2592f86f7ecef70b58ea8bb66ca626bf62c32a710e97f803c067ee20b8a8d0af9ab7dadce3d851ad24ee99999b8d57d5b06f7dbcf75521c19dc3d8fac872708d948435fc56a1ea29bb55cebba8edb1ffefabee03bb3ed47c6f20859c5b8d5154318522240a48fa16f3f171879fa24d302745510203010001a38209c8308209c4308201f4060a2b06010401d679020402048201e4048201e001de007500ee4bbdb775ce60bae142691fabe19e66a30f7e5fb072d88300c47b897aa8fdcb0000016a700a46cc000004030046304402202201222ce63d7d55c4cb6f170e187425225eb67778b2d4563c76736afba95e6d02207216d2ab6421efccec9a6b9ccac96e701c9c8a3fc56147b717594da49881f4ab0076005581d4c2169036014aea0b9b573c53f0c0e43878702508172fa3aa1d0713d30c0000016a700a48030000040300473045022100f1e91a9cbc375f218f6a740b9a445055bd21cdb6da40ce27b728ff400221af07022048cbe3b1efe126eb03a11167493b57f7a89ead36aacd01f8a032cb9d6fc6c1cd0075005cdc4392fee6ab4544b15e9ad456e61037fbd5fa47dca17394b25ee6f6c70eca0000016a700a46e60000040300463044022026d817a2eff77045af02e0bb399ab3fe6043cedfcd11e44da3310d20fb3e585102203f0d739e4dc1da8943d05ac29b27fef1f4458abd58acaad40c9d893a701c5b070076004494652eb0eeceafc44007d8a8fe28c0dae682bed8cb31b53fd33396b5b681a80000016a700a46da000004030047304502206ab7517d1edbc70486176d766bad37757633e8ee73607a4f92cf3f451fc03334022100f85580c3fb6cd50c7123cfc7a590a133860cd374e32d735c9884253e78700692302706092b060104018237150a041a3018300a06082b06010505070302300a06082b06010505070301303e06092b06010401823715070431302f06272b060104018237150887da867583eed90182c9851b81b59e6185f4eb60815d84d2df4282e7937a02016402011d30818506082b0601050507010104793077305106082b060105050730028645687474703a2f2f7777772e6d6963726f736f66742e636f6d2f706b692f6d73636f72702f4d6963726f736f66742532304954253230544c532532304341253230322e637274302206082b060105050730018616687474703a2f2f6f6373702e6d736f6373702e636f6d301d0603551d0e041604143707b59b7c1e429244ef044e24e408b8b107d3da300b0603551d0f0404030204b03082056d
70|0.568776|TCP(TCP)|57953 \xe2\x86\x92 443 [ACK] Seq=207 Ack=1461 Win=262144 Len=0|192.168.1.244:57953|204.79.197.200:443|54|
71|0.569137|TCP(TCP)|443 \xe2\x86\x92 57953 [ACK] Seq=1461 Ack=207 Win=2102272 Len=1460 [TCP segment of a reassembled PDU]|204.79.197.200:443|192.168.1.244:57953|1514|0603551d110482056430820560820c7777772e62696e672e636f6d8210646963742e62696e672e636f6d2e636e82132a2e706c6174666f726d2e62696e672e636f6d820a2a2e62696e672e636f6d820862696e672e636f6d821669656f6e6c696e652e6d6963726f736f66742e636f6d82132a2e77696e646f77737365617263682e636f6d8219636e2e69656f6e6c696e652e6d6963726f736f66742e636f6d82112a2e6f726967696e2e62696e672e636f6d820d2a2e6d6d2e62696e672e6e6574820e2a2e6170692e62696e672e636f6d821865636e2e6465762e7669727475616c65617274682e6e6574820d2a2e636e2e62696e672e6e6574820d2a2e636e2e62696e672e636f6d821073736c2d6170692e62696e672e636f6d821073736c2d6170692e62696e672e6e6574820e2a2e6170692e62696e672e6e6574820e2a2e62696e67617069732e636f6d820f62696e6773616e64626f782e636f6d8216666565646261636b2e6d6963726f736f66742e636f6d821b696e736572746d656469612e62696e672e6f66666963652e6e6574820e722e6261742e62696e672e636f6d82102a2e722e6261742e62696e672e636f6d82122a2e646963742e62696e672e636f6d2e636e820f2a2e646963742e62696e672e636f6d820e2a2e73736c2e62696e672e636f6d82102a2e61707065782e62696e672e636f6d82162a2e706c6174666f726d2e636e2e62696e672e636f6d820d77702e6d2e62696e672e636f6d820c2a2e6d2e62696e672e636f6d820f676c6f62616c2e62696e672e636f6d821177696e646f77737365617263682e636f6d820e7365617263682e6d736e2e636f6d82112a2e62696e6773616e64626f782e636f6d82192a2e6170692e74696c65732e646974752e6c6976652e636f6d820f2a2e646974752e6c6976652e636f6d82182a2e74302e74696c65732e646974752e6c6976652e636f6d82182a2e74312e74696c65732e646974752e6c6976652e636f6d82182a2e74322e74696c65732e646974752e6c6976652e636f6d82182a2e74332e74696c65732e646974752e6c6976652e636f6d82152a2e74696c65732e646974752e6c6976652e636f6d820b33642e6c6976652e636f6d82136170692e7365617263682e6c6976652e636f6d8214626574612e7365617263682e6c6976652e636f6d8215636e7765622e7365617263682e6c6976652e636f6d820c6465762e6c6976652e636f6d820d646974752e6c6976652e636f6d821166617265636173742e6c6976652e636f6d820e696d6167652e6c6976652e636f6d820f696d616765732e6c6976652e636f6d82116c6f63616c2e6c6976652e636f6d2e617582146c6f63616c7365617263682e6c6976652e636f6d82146c7334642e7365617263682e6c6976652e636f6d820d6d61696c2e6c6976652e636f6d82116d6170696e6469612e6c6976652e636f6d820e6c6f63616c2e6c6976652e636f6d820d6d6170732e6c6976652e636f6d82106d6170732e6c6976652e636f6d2e6175820f6d696e6469612e6c6976652e636f6d820d6e6577732e6c6976652e636f6d821c6f726967696e2e636e7765622e7365617263682e6c6976652e636f6d8216707265766965772e6c6f63616c2e6c6976652e636f6d820f7365617263682e6c6976652e636f6d8212746573742e6d6170732e6c6976652e636f6d820e766964656f2e6c6976652e636f6d820f766964656f732e6c6976652e636f6d82157669727475616c65617274682e6c6976652e636f6d820c7761702e6c6976652e636f6d82127765626d61737465722e6c6976652e636f6d82137765626d6173746572732e6c6976652e636f6d82157777772e6c6f63616c2e6c6976652e636f6d2e617582147777772e6d6170732e6c6976652e636f6d2e61753081ac0603551d1f0481a43081a130819ea0819ba08198864b687474703a2f2f6d7363726c2e6d6963726f736f66742e636f6d2f706b692f6d73636f72702f63726c2f4d696372
72|0.569138|TCP(TCP)|443 \xe2\x86\x92 57953 [ACK] Seq=2921 Ack=207 Win=2102272 Len=1460 [TCP segment of a reassembled PDU]|204.79.197.200:443|192.168.1.244:57953|1514|6f736f66742532304954253230544c532532304341253230322e63726c8649687474703a2f2f63726c2e6d6963726f736f66742e636f6d2f706b692f6d73636f72702f63726c2f4d6963726f736f66742532304954253230544c532532304341253230322e63726c304d0603551d2004463044304206092b0601040182372a013035303306082b060105050702011627687474703a2f2f7777772e6d6963726f736f66742e636f6d2f706b692f6d73636f72702f637073301f0603551d23041830168014919e3b446c3d579c42772a34d74fd1cc4a972cda301d0603551d250416301406082b0601050507030206082b06010505070301300d06092a864886f70d01010b050003820201000d6034917992ce50ae0d3fa9e39741b70edd20acf872932b154bf1075a4cbdece60b26590cdc60d4baef50e6378944a1bda059664ac8a03341b8c339c7fd9ddc57e3e8be3da0b0e4adee38d6cc3b09ee382c11bc3cbc604a026f73b32855f8b23ce1d4754bfe58ca1d43d3fbd6a9fd2a58b1eacdc62c626ea1762d9631fbd870af56dcc7d196ae0dc2a0550581266a450d787a22bde2233993324b2b29ca3e17b3f943b04b95517afd66c61e670fd8413f35c71ea23d98d5aefe5cabeca3d432282241f28a66ea95e96de2d47dc1a098b5b8390bdd2268d45dfd5cddc0c864806564bd44d9f9273110406889463af3fcf135bd38350656ec3dd29ae2019919d18159c8f679765cf866cba53cb7a9696626b127d8a18b7a89b29dd95fb513c5ac1507ff9322a3939e49ac2395a701576e5f29aa19d413dcde2f8718a77972d75d0b2ea426c81d303db6d731af7ffd2e5b6e59226cc3787eca90e7066f3c962700730e0adad113fea9180adda60f49623cd4e2e59c727654e8b1fd453adcd08ad9f3bf511cc4f0ac681eb811197084e76be21efea4b0bed05d67a56c4454ec6129719535b2e3e10e8867e02adfac26028e96b962ce9c8bb46b7a7f364ac5c905f36b826d94e25c567f35a3fb6032eb20136dda0e3e7b6e7bc71b6cca13ce834c1d05c3d83a63b453ecf3f45538541bd0815596e0ab4c09c7988f2d4edb26ce0eb30005b8308205b43082049ca00302010202100f2c10c95b06c0937fb8d449f83e8569300d06092a864886f70d01010b0500305a310b300906035504061302494531123010060355040a130942616c74696d6f726531133011060355040b130a43796265725472757374312230200603550403131942616c74696d6f7265204379626572547275737420526f6f74301e170d3136303532303132353135375a170d3234303532303132353135375a30818b310b3009060355040613025553311330110603550408130a57617368696e67746f6e3110300e060355040713075265646d6f6e64311e301c060355040a13154d6963726f736f667420436f72706f726174696f6e31153013060355040b130c4d6963726f736f6674204954311e301c060355040313154d6963726f736f667420495420544c53204341203230820222300d06092a864886f70d01010105000382020f003082020a02820201009eaa15c11ba1635fe65118c516bb11dc0b4d9b910aba40492bdcd6060bc577592c3442450b4ea8c916f028f31f9695bf1ed39fcc87819621a4e7b33066ad7c6e0012afbd2c3d45aea03f75ec752005fc4162817ccc0ed921ee7300738315ba092fb160fdaa606d0b3f1a26593428b44244145b3c349d3526552350d26cfaa42bbde43bf558cb0b1b23c67dd37dcc3dd0fd0103c89ebde50823448c580350d413ee78b62da4eabd3270a150624c96c19db91c3d61da462dde8bd6f39bc5eb2eed8d3a9411c2db80a50207cd7ff79e6174b2ec6c577a7fda363e453cc6e39cdd4f9b51e76fbfa49bb6f1a304465e1721fcfc269087396c28c1f4f8e3ce16ffdb32a70b6ab3f0d55d6c395d5b9785bdbe2db6efc9e26e5cc86c41edee737cf3ca7828d230a8271768685bb52e2d8e7dcd288eafd5dd97472c48bc22438e0a19d3dcc5dfd3f2a1ef76b1246291987b
73|0.569138|TCP(TCP)|443 \xe2\x86\x92 57953 [ACK] Seq=4381 Ack=207 Win=2102272 Len=1460 [TCP segment of a reassembled PDU]|204.79.197.200:443|192.168.1.244:57953|1514|c67b38b50110f010ace28e4d052c7c53112c832ccd4ac9161845aab088edfbbf80d6c9030d9bfa936a3c5421cd6d32c5292eddef6c0c23812ba7356c04889cc5a1b67b3b8c041baa4e1c48889f86f737e83fd9718a6ffdaef240c5b8779ee8c0d5525f90e613248a23100602c51dd08c4a0675aa4998195ef7b01fa84067c2826cbb6c1abfc87dbfea680cbe21e9d473454c58d431f2a5c1655c6a07bbf44442014bab620ddf4fc08502cdf743e3f534f645010203010001a38201423082013e301d0603551d0e04160414919e3b446c3d579c42772a34d74fd1cc4a972cda301f0603551d23041830168014e59d5930824758ccacfa085436867b3ab5044df030120603551d130101ff040830060101ff020100300e0603551d0f0101ff04040302018630270603551d250420301e06082b0601050507030106082b0601050507030206082b06010505070309303406082b0601050507010104283026302406082b060105050730018618687474703a2f2f6f6373702e64696769636572742e636f6d303a0603551d1f04333031302fa02da02b8629687474703a2f2f63726c332e64696769636572742e636f6d2f4f6d6e69726f6f74323032352e63726c303d0603551d200436303430320604551d2000302a302806082b06010505070201161c68747470733a2f2f7777772e64696769636572742e636f6d2f435053300d06092a864886f70d01010b050003820101006c7fea6a6fcf6b5bc134acffdc0ee07d8b1317e02f4e590ec403b9f405296547ae199ae854f664d5d8bd06e07122197bce9add798bdf70274868dbf76f3319b565eb9f9007ccb847397d0f5113910d80d476502b8507606d6d599a294016c6c70de06a574b8009bfefc74b4557b394aed7d2740c0f0183e968f1e90297876ad86d66d56b02bc5048a0b2237789de08b946a314f68c0e37963d89a50fd23242e42f2f435e3fc91ddb2a243479a207228f85485fc57e6d50f4342c3b9106ba525abd668d230c4ab56ade3349e1f8995d8f30cdcbc085c1036c68e6c75ad5c9d4589a373eae2e32070b7b4b7e7c2baddfc34c91397c1746ab7e5b296aa515554a2f1600072b01000727308207230a0100a082071c3082071806092b060105050730010104820709308207053081c7a2160414108a72f9f95647f20b2cdbd20458484e0b24dcf3180f32303230303530333038333532395a30819b308198304c300906052b0e03021a05000414881a4a74feff4652f354bb510fd3a4eeefe0a1c80414919e3b446c3d579c42772a34d74fd1cc4a972cda02132000060f1b8eb1ce4263468342000000060f1b8000180f32303230303530333038333532395aa011180f32303230303530373038333532395aa1223020301e06092b06010505073001060411180f32303139303530343038333532395a300d06092a864886f70d01010b05000382010100b64335f1c0517a20228c969a17c67c19f1918ecb7a14ca2affa6b02323ef74af7f67ce893cce6fffd32fc5a3605b098f6e004093bfb2b93f5e6e5d30101cd695d1b13493bb6bfd5b430063a5cfcd4c773a40c655bd43d88f8571445d674406732ecbe1234f61d8685189d29f3ec4ba27789ed7d8fdf1c3c3285afa7e529335fa6a8c53bdd29fb260409ea541f921a7f71e0208d5c03b8beed53949a6c2dd7418772f3aad579a08ad6cb0ea61c6f784f6686c15445dab1695ec0019d96c0d31d511b9888c669a5484413d52243b88fe2179df2726abe40477b05697587131b04a41e701769b1dc74b6d638b2c0833fdbadb1753725a0ea2df2d4ff7f68c61f2bca08205233082051f3082051b30820303a00302010202131c0015d114ec45e42781e82dd500000015d114300d06092a864886f70d01010b050030818b310b3009060355040613025553311330110603550408130a57617368696e67746f6e3110300e060355040713075265646d6f6e64311e301c060355040a13154d6963726f736f667420436f72706f726174696f6e31153013060355040b13
